{
  "id": "doom-env",
  "name": "DOOM RL Environment",
  "kind": "env",
  "version": "1.0.0",
  "description": "DOOM tactical 2.5D simulation gymnasium environment for reinforcement learning.",
  "author": {
    "name": "Cameron Egbert",
    "github": "CameronEgb",
    "url": "https://github.com/CameronEgb"
  },
  "repository": "https://github.com/CameronEgb/theta-plugins",
  "license": "MIT",
  "tags": [
    "doom",
    "rl",
    "tactical",
    "gym",
    "environment"
  ],
  "target_path": "in/envs/doom",
  "releases": {
    "1.0.0": {
      "tag": "v1.0.0",
      "url": "https://raw.githubusercontent.com/CameronEgb/theta-hub/main/packages/doom_env-1.0.0.zip",
      "sha256": "1e24dfcec1a229ec395b2c920d49de816eb89a2b43b44d1d707a618d3eba96c9",
      "published_at": "2026-10-16T19:00:00Z"
    }
  }
}
