{
  "id": "basic_suite",
  "name": "Basic Benchmark Suite",
  "kind": "suite",
  "version": "1.0.0",
  "description": "Basic reinforcement learning benchmark suite for Theta-IDE: Stable-Baselines3, d3rlpy offline baselines, Atari 2600 (ALE), Gymnasium classic control, and standard deep neural network architectures.",
  "author": {
    "name": "Theta-IDE Team"
  },
  "tags": [
    "suite",
    "basic_suite"
  ],
  "releases": {
    "1.0.0": {
      "tag": "v1.0.0",
      "url": "https://raw.githubusercontent.com/CameronEgb/theta-hub/main/packages/basic_suite-1.0.0.zip",
      "sha256": "20096a99892043cdea929bba3d677a21064555ecf024093070969e42cb1ba19a",
      "published_at": "2026-10-16T19:00:00Z"
    }
  },
  "repository": "https://github.com/CameronEgb/theta-plugins",
  "license": "MIT"
}
