{
  "id": "standard_rl_suite",
  "name": "Standard RL Suite",
  "kind": "suite",
  "version": "1.0.0",
  "description": "Complete reinforcement learning stack for Theta-IDE: DNN, NatureCNN, and Dueling ResNet models; Online and Offline baselines; and Gymnasium Classic Control environments.",
  "author": {
    "name": "Theta-IDE Team"
  },
  "tags": [
    "suite",
    "standard_rl_suite"
  ],
  "releases": {
    "1.0.0": {
      "tag": "v1.0.0",
      "url": "https://raw.githubusercontent.com/CameronEgb/theta-hub/main/packages/standard_rl_suite-1.0.0.zip",
      "sha256": "8977188bdf4797013d45b3ca82e1f3afaaaf206b1485c0721d9337a52367e9d6",
      "published_at": "2026-10-16T19:00:00Z"
    }
  },
  "repository": "https://github.com/CameronEgb/theta-plugins",
  "license": "MIT"
}
