{
  "id": "antigravity",
  "name": "Antigravity Agent",
  "kind": "plugin",
  "version": "0.1.2",
  "description": "Integrated Google Antigravity Agent for pair programming and codebase assistance.",
  "author": {
    "name": "Antigravity Team",
    "github": "google-antigravity",
    "url": "https://antigravity.google/"
  },
  "repository": "https://github.com/CameronEgb/Theta-IDE",
  "license": "MIT",
  "tags": ["ai", "agent", "assistant", "antigravity"],
  "target_path": "plugins/antigravity",
  "releases": {
    "0.1.2": {
      "tag": "v0.1.2",
      "url": "https://raw.githubusercontent.com/CameronEgb/theta-hub/main/packages/antigravity-0.1.2.zip",
      "sha256": "59e516784904f435b97f6cf6a41c7a60df5134f3d057e4bfdda4f84dc2f3e010",
      "published_at": "2026-09-29T00:00:00Z"
    },
    "0.1.1": {
      "tag": "v0.1.1",
      "url": "https://raw.githubusercontent.com/CameronEgb/theta-hub/main/packages/antigravity-0.1.1.zip",
      "sha256": "c2f54e1c2909b4411ff8c0915185c0372bae4a7797ef52f430f98aa26783218f",
      "published_at": "2026-09-29T00:00:00Z"
    },
    "0.1.0": {
      "tag": "v0.1.0",
      "url": "https://raw.githubusercontent.com/CameronEgb/theta-hub/main/packages/antigravity-0.1.0.zip",
      "sha256": "19fdfa859e6b831123a0ccec355208fd90eb449296aea8cefaf644637af654d8",
      "published_at": "2026-09-29T00:00:00Z"
    }
  }
}
