{
  "id": "wandb-monitor",
  "name": "Weights & Biases Live Sync",
  "kind": "plugin",
  "version": "0.2.1",
  "description": "Streams real-time training losses, rewards, and evaluation metrics directly to W&B dashboards.",
  "author": {
    "name": "NeSyRL Community",
    "github": "nesyrl"
  },
  "repository": "https://github.com/nesyrl/theta-plugin-wandb",
  "license": "Apache-2.0",
  "tags": ["wandb", "telemetry", "visualization", "monitoring"],
  "target_path": "plugins/wandb",
  "releases": {
    "0.2.1": {
      "tag": "v0.2.1",
      "url": "https://raw.githubusercontent.com/CameronEgb/theta-hub/main/packages/wandb-0.2.1.zip",
      "sha256": "18ef286e692c9757221c472bff6a8747cb7548159d3be55c4e1bb66b1346dc83",
      "published_at": "2026-09-25T12:00:00Z"
    }
  }
}
