{
  "id": "mujoco-ant-maze",
  "name": "MuJoCo AntMaze Navigation",
  "kind": "env",
  "version": "0.1.5",
  "description": "Vectorized D4RL AntMaze benchmark environment wrappers with sparse and shaped reward profiles.",
  "author": {
    "name": "Gym Contributors",
    "github": "farama"
  },
  "repository": "https://github.com/farama/antmaze-wrappers",
  "license": "MIT",
  "tags": ["mujoco", "antmaze", "d4rl", "offline-rl"],
  "target_path": "in/envs/antmaze",
  "releases": {
    "0.1.5": {
      "tag": "v0.1.5",
      "url": "https://raw.githubusercontent.com/CameronEgb/theta-hub/main/packages/antmaze-0.1.5.zip",
      "sha256": "a2f5575a23d7b4a604efe0065975cd34d25d2e33b039995b4cef2501c1b16caf",
      "published_at": "2026-09-15T14:00:00Z"
    }
  }
}
