{
  "id": "cew",
  "name": "Clinical Expert Weighting (CEW)",
  "kind": "model",
  "version": "1.0.0",
  "description": "Self-organizing neuro-fuzzy Q-function with CLIP, ECM clustering, and Wang-Mendel rule generation.",
  "author": {
    "name": "NeSyRL Contributors",
    "github": "CameronEgb"
  },
  "repository": "https://github.com/CameronEgb/Offline-BlendRL",
  "license": "MIT",
  "tags": [
    "fuzzy",
    "neuro-symbolic",
    "offline-rl",
    "interpretability",
    "cew"
  ],
  "target_path": "src/usr/models/cew",
  "releases": {
    "1.0.0": {
      "tag": "v1.0.0",
      "url": "https://raw.githubusercontent.com/CameronEgb/theta-hub/main/packages/cew-1.0.0.zip",
      "sha256": "a736032241682b3f439dbba2ac6fa65095996dbd1fa07380794c7cdbd1cad785",
      "published_at": "2026-10-16T19:00:00Z"
    }
  },
  "paradigms": [
    "online_rl",
    "offline_rl",
    "supervised"
  ]
}
